,Name,Rating,Reviews,Company_type,Head_Quarters,Company_Age,No_of_Employees,Description
140,Kotak Mahindra B...,3.9,(14.1k Reviews),Public,"Mumbai,Maharashtra + 480 more",19 years old,50k-1 Lakh Employees (India),"In February 2003, Kotak Mahindra Finance Ltd. (KMFL), the Group's flagship company, received banking license from the Reserve Bank of India (RBI), becoming the first non-banking finance company in India to convert into a bank - Kotak Mahindra Bank Ltd.
Effective April 1, 2015, ING Vysya Bank Ltd. merged with Kotak Mahindra Bank Ltd. 
The Bank has four Strategic Business Units – Consumer Banking, Corporate Banking, Commercial Banking and Treasury, which cater to retail and corporate customers across urban and rural India.

The Group offers a wide range of financial services that encompass every sphere of life. From commercial banking, to stock broking, mutual funds, life insurance and investment banking, the Group caters to the diverse financial needs of individuals and the corporate sector. The Group has a wide distribution network through branches and franchisees across India, and international offices in London, New York, California, Dubai, Abu Dhabi, Bahrain, Mauritius and Singapore."
141,Reliance Industr...,4.1,(45.4k Reviews),Public,"Navi Mumbai,Maharashtra + 495 more",49 years old,1 Lakh+ Employees (India),"RIL is India’s largest private sector company, with a consolidated turnover of Rs.659,205 crore ($87.1 billion), cash profit of Rs.71,446 crores ($9.4 billion), and net profit of Rs39,880 crore ($5.3 billion) for the year ended March 31, 2020.
RIL’s activities span hydrocarbon exploration and production, petroleum refining and marketing, petrochemicals, retail and digital services. RIL is the top-most ranked company from India to feature in Fortune’s Global 500 list of ‘World’s Largest Companies’ – currently ranking 96th. The company stands 58th in the ‘Forbes Global 2000’ rankings for 2020 – top-most among Indian companies. RIL has also featured in Forbes' list of ""World's Best Employers 2020” and has ranked 81st. It ranks 10th among LinkedIn’s ‘The Best Companies to Work for In India’ (2019).  RIL is also a GPTWTM Certified organisation and features as a part of the GPTW “Best Workplaces in Manufacturing 2021” list."
142,Reliance Retail,4.1,(16.5k Reviews),Private,"Navi Mumbai,Maharashtra + 675 more",16 years old,1 Lakh+ Employees (India),"Reliance Retail is the retail initiative of Reliance Industries Limited and is central to the group’s consumer facing businesses. Reliance Retail has been at the forefront of bringing about Organized Retail revolution in India.

Reliance Retail’s operating model unleashes the aspirational energy of the new, resurgent India. Reliance Retail’s guiding philosophy rests on the tenets of enabling inclusion, growth and building sustainable societal value for millions of Indians.

In a short period, it has forged strong and enduring bonds with millions of consumers by providing them unlimited choice, outstanding value proposition, superior quality and unmatched shopping experience across all its stores.

Reliance Retail’s growth over the years has triggered a large socio-economic transformation on an extraordinary scale in India.

Reliance Retail has been ranked as the fastest growing retailer in the world. It is ranked 53rd in the list of Top Global Retailers and is the only Indian Retailer to feature in the Top 100. It is the largest and the most profitable retailer in India with the widest reach.

Reliance Retail has more than 150 million loyal customers buying across all its formats. It recorded more than 640 million footfalls across all its stores in FY20, a scale unmatched by any other retailer in India. With over 100,000 transactions per hour, Reliance Retail operates at a scale unparalleled in the Indian retail industry and continues to enrich the quality of lives of millions of Indians every day. Reliance Retail has adopted a multi-prong strategy and operates a wide array of store formats which cater to planned shopping needs as well as daily or occasional needs of the customers across major consumption baskets of Grocery, Consumer Electronics and Fashion & Lifestyle.

In Grocery consumption basket, Reliance Retail operates Reliance Fresh, Shree Kannan Departmental stores, SMART and Smart Point store formats focused on food, fresh produce, bakery, dairy products, home and personal care products, as well as general merchandise items.

In Consumer Electronics consumption basket, Reliance Retail operates Reliance Digital and MyJio Store formats offering a wide range of consumer electronics, home appliances, computing and mobility products, latest gadgets and accessories. These stores are backed by ResQ, a full-fledged service organisation and India’s only ISO 9001 certified electronics service brand.

In Fashion and Lifestyle consumption basket, Reliance Retail operates a portfolio of formats that serves customers across value, mid, premium and luxury segments. Reliance Retail operates Trends, Trends Woman, Trends Man, Trends Footwear, Project Eve, Reliance Jewels, Hamleys formats and a portfolio of more than 40 marquee international brands such as Armani, Burberry, Diesel, GAS, Marks & Spencer, Superdry, Brooks Brothers, Steve Madden and more. Reliance Retail has a strong presence in digital commerce channels through AJIO.com, a curated fashion & lifestyle store bringing best of national and international brands to customers doorsteps and Jiomart, India's largest hyperlocal retail solution that leverages the wide network of Reliance Retail's grocery stores and well-established supply chain infrastructure.

Reliance Retail reported a turnover of Rs. 1,57,629 crore (US$ 21.6 billion) for the financial year 2020-21. As on 31st Mar 2021, Reliance Retail operated 12,711 stores across 7,000+ cities with a retail area of over 33.8 million sft.

Reliance Retail Ventures Limited, a subsidiary of Reliance Industries Limited is the holding company of Reliance Retail Limited which operates the retail business."
143,Bharti Airtel,4.1,(13.2k Reviews),Public,"Gurgaon/Gurugram,Haryana + 520 more",27 years old,10k-50k Employees (India),"Bharti Airtel Limited is a leading global telecommunications company with operations in 18 countries across Asia and Africa. Headquartered in New Delhi, India, the company ranks amongst the top 3 mobile service providers globally in terms of subscribers. In India, the company's product offerings include 2G, 3G and 4G wireless services, mobile commerce, fixed line services, high speed home broadband, DTH, enterprise services including national & international long distance services to carriers. In the rest of the geographies, it offers 2G, 3G, 4G wireless services and mobile commerce. Bharti Airtel had over 403 million customers across its operations at the end of March 2019."
144,Deloitte,4.1,(10.6k Reviews),Private,"New York,New York + 135 more",177 years old,50k-1 Lakh Employees (India),"Deloitte drives progress. Our firms around the world help clients become leaders wherever they choose to compete. Deloitte invests in outstanding people of diverse talents and backgrounds and empowers them to achieve more than they could elsewhere. Our work combines advice with action and integrity. We believe that when our clients and society are stronger, so are we. 

Deloitte refers to one or more of Deloitte Touche Tohmatsu Limited (“DTTL”), its global network of member firms, and their related entities. DTTL (also referred to as “Deloitte Global”) and each of its member firms are legally separate and independent entities. DTTL does not provide services to clients."
145,Tata Motors,4.1,(12.7k Reviews),Public,"Pune,Maharashtra + 398 more",77 years old,10k-50k Employees (India),"Tata Motors Group (Tata Motors) is a $34 billion organization. It is a leading global automobile manufacturing company. Its diverse portfolio includes an extensive range of cars, sports utility vehicles, trucks, buses, and defence vehicles. 

Tata Motors is one of India's largest OEMs offering an extensive range of integrated, smart, and e-mobility solutions. Part of the USD110 billion Tata group founded by Jamsetji Tata in 1868, Tata Motors is among the world’s leading manufacturers of automobiles. 

We believe in ‘Connecting aspirations’, by offering innovative mobility solutions that are in line with customers' aspirations. We are India's largest automobile manufacturer, and we continue to take the lead in shaping the Indian commercial vehicle landscape, with the introduction of leading-edge powertrains and electric solutions packaged for power performances and user comfort at the lowest life-cycle costs. 

Our new passenger cars and utility vehicles are based on Impact Design and offer a superior blend of performance, driveability, and connectivity.

Our focus on connecting aspirations and our pipeline of tech-enabled products keeps us at the forefront of the market. We have identified six key mobility drivers that will lead us into the future – modular architecture, complexity reduction in manufacturing, connected & autonomous vehicles, clean drivelines, shared mobility, and low total cost of ownership. 

Our sub-brand TAMO is an incubating centre of innovation that will spark new mobility solutions through new technologies, business models, and partnerships."
146,BYJU'S,3.5,(12.7k Reviews),Private,"Bangalore,Karnataka + 248 more",11 years old,1k-5k Employees (India),"BYJU'S is the world's most valuable ed-tech company and the creator of India's most loved school learning app. Launched in 2015, BYJU'S offers highly personalised and effective learning programs for classes 1 - 12 (K-12), and aspirants of competitive exams like JEE, IAS etc. With 50 million registered students and 3.5 million paid subscriptions, BYJU'S has become one of the most preferred education platforms across the globe."
147,Flipkart,4.2,(11.9k Reviews),Public,"Bangalore,Karnataka + 446 more",15 years old,50k-1 Lakh Employees (India),"The Flipkart Group is one of India’s leading digital commerce entities and includes group companies Flipkart, Myntra, and Jabong. Launched in 2007, Flipkart has enabled millions of consumers, sellers, merchants and small businesses to be a part of India’s e-commerce revolution. With a registered customer base of over 100 million, offering over 80 million products across 80+ categories, Flipkart is known for pioneering services such as Cash on Delivery, No Cost EMI and easy returns – customer-centric innovations that have made online shopping more accessible and affordable for millions of Indians. Together with Myntra and Jabong, which hold prominent positions in the online fashion market, the Flipkart Group has steered the transformation of commerce in India through technology."
148,WNS,3.7,(7.2k Reviews),Private,"Mumbai,Maharashtra + 25 more",26 years old,10k-50k Employees (India),"WNS Limited is a leading Business Process Management (BPM) company. WNS combines deep industry knowledge with technology, analytics, and process expertise to co-create innovative, digitally-led transformational solutions with over 375 clients across various industries. 
WNS delivers an entire spectrum of BPM solutions including industry-specific offerings, customer experience services, finance and accounting, human resources, procurement, and research and analytics to re-imagine the digital future of businesses. As of December 31, 2021, WNS had 49,610 professionals across 55 delivery centers worldwide including facilities in China, Costa Rica, India, the Philippines, Poland, Romania, South Africa, Spain, Sri Lanka, Turkey, the United Kingdom, and the United States."
149,Mahindra & Mahin...,3.9,(40.7k Reviews),Public,"Mumbai,Maharashtra + 413 more",77 years old,1 Lakh+ Employees (India),"A federation of companies, bound by one purpose – to Rise. Inspired by this spirit, our legacy, and values, our goal to always positively impact our partners, stakeholders, communities, and the world at large, remains unshakeable.

What began as a steel-trading venture seven decades ago, steadily turned into a global brand, spanning nations and industries. This is a story with an upward curve, narrating how an Indian company paved its way to become a global powerhouse. We have come a long way since 1945 and as we accelerate into the 21st century, we aim at achieving even more."
150,TCS,3.9,(51.4k Reviews),Public,"Mumbai,Maharashtra + 280 more",54 years old,1 Lakh+ Employees (India),"We ensure the highest levels of certainty and satisfaction through a deep-set commitment to our clients, comprehensive industry expertise and a global network of innovation and delivery centers.

We function as a full stakeholder to business, offering a consulting-led approach with an integrated portfolio of technology led solutions that encompass the entire Enterprise value chain. Our Customer-centric Engagement Model defines how we do engage with you, offering specialized services and solutions that meet the distinct needs of your business.

We build bespoke teams around your domain and technology requirements drawn from our talent pool of over 488,649 global professionals including 36.5% women from 154 nationalities. Our domain expertise has been built upon decades of experience working across industries and this knowledge underpins our suite of solutions.

Our organization structure is domain led and empowered to help provide Customers a single window to industry specific solutions. Agile industry units have embedded capabilities to enable rapid responses that provide a competitive edge to our Customers. This is coupled with a unique Global Network Delivery Model™ (GNDM™), spanning 40 global locations, that is today recognized as the benchmark of excellence in technology deployment.

We have made significant investments in Digital platforms and products spanning Technology Products, Horizontal Platforms and Products, Vertical Platforms and Products."
151,Accenture,4.1,(33.2k Reviews),Public,Dublin + 144 more,33 years old,1 Lakh+ Employees (India),"Accenture is a global professional services company with leading capabilities in digital, cloud, and security. Combining unmatched experience and specialized skills across more than 40 industries, we offer Strategy and Consulting, Interactive, Technology, and Operations services — all powered by the world’s largest network of Advanced Technology and Intelligent Operations centers. Our 674,000 people deliver on the promise of technology and human ingenuity every day, serving clients in more than 120 countries. We embrace the power of change to create value and shared success for our clients, people, shareholders, partners, and communities. Visit us at accenture.com."
152,Cognizant,3.9,(30.5k Reviews),Private,Teaneck. New Jersey. + 102 more,28 years old,1 Lakh+ Employees (India),"At Cognizant, we give organizations the insights to anticipate what customers want and act instantly to deliver on those demands. So they can achieve the goal of every modern business: staying one step ahead of a fast-changing world."
153,ICICI Bank,4.0,(35.6k Reviews),Public,"Mumbai,Maharashtra + 1057 more",28 years old,1 Lakh+ Employees (India),"ICICI Bank is a leading private sector bank in India. The Bank’s consolidated total assets stood at Rs. 14.76 trillion at September 30, 2020.  ICICI Bank currently has a network of 5,288 branches and 13,875 ATMs across India."
154,HDFC Bank,4.0,(41k Reviews),Public,"Mumbai,Maharashtra + 1238 more",28 years old,1 Lakh+ Employees (India),"The Housing Development Finance Corporation Limited or HDFC was among the first financial institutions in India to receive an “in principle” approval from the Reserve Bank of India (RBI) to set up a bank in the private sector. This was done as part of RBI’s policy for the liberalization of the Indian banking industry in 1994.

HDFC Bank was incorporated in August 1994 in the name of HDFC Bank Limited, with its registered office in Mumbai, India. The bank commenced operations as a Scheduled Commercial Bank in January 1995. As of March 31, 2021, the Bank had a nationwide distribution network of 5,608 branches and 16,087 ATMs in 2,902 cities/towns."
155,Wipro,3.9,(29.5k Reviews),Public,"Bangalore/Bengaluru,Karnataka + 233 more",77 years old,1 Lakh+ Employees (India),"Wipro Limited (NYSE: WIT, BSE: 507685, NSE: WIPRO) is a leading global information technology, consulting, and business process services company.

We harness the power of cognitive computing, hyper-automation, robotics, cloud, analytics, and emerging technologies to help our clients adapt to the digital world and make them successful.

A company recognized globally for its comprehensive portfolio of services, a strong commitment to sustainability, and good corporate citizenship, we have over 243,000 dedicated employees serving clients across six continents.

Together, we discover ideas and connect the dots to build a better and bold new future."
156,Infosys,3.9,(29k Reviews),Public,"Bengaluru/Bangalore,Karnataka + 130 more",41 years old,1 Lakh+ Employees (India),"Infosys is a global leader in next-generation digital services and consulting. Over 300,000 of our people work to amplify human potential and create the next opportunity for people, businesses, and communities. 

With over four decades of experience in managing the systems and workings of global enterprises, we expertly steer clients, in more than 50 countries, as they navigate their digital transformation powered by the cloud. 

We enable them with an AI-powered core, empower the business with agile digital at scale and drive continuous improvement with always-on learning through the transfer of digital skills, expertise, and ideas from our innovation ecosystem. We are deeply committed to being a well-governed, environmentally sustainable organization where diverse talent thrives in an inclusive workplace.

Our purpose is to amplify human potential and create the next opportunity for people, businesses, and communities."
157,Capgemini,3.9,(24.6k Reviews),Public,Paris + 81 more,55 years old,1 Lakh+ Employees (India),"Capgemini is a global leader in partnering with companies to transform and manage their business by harnessing the power of technology. 

The Group is guided everyday by its purpose of unleashing human energy through technology for an inclusive and sustainable future. It is a responsible and diverse organization of over 350,000 team members in more than 50 countries. 

With its strong 55 year heritage and deep industry expertise, Capgemini is trusted by its clients to address the entire breadth of their business needs, from strategy and design to operations, fueled by the fast evolving and innovative world of cloud, data, AI, connectivity, software, digital engineering and platforms. 

The Group reported in 2021 global revenues of €18 billion.

Get the Future You Want |  www.capgemini.com/in-en"
158,Tech Mahindra,3.7,(22.4k Reviews),Public,"Pune,Maharashtra + 219 more",36 years old,50k-1 Lakh Employees (India),"Tech Mahindra offers innovative and customer-centric digital experiences, enabling enterprises, associates, and society to rise. We are a USD 5.1 billion organization with 141,100+ professionals across 90 countries helping 1123 global customers, including Fortune 500 companies. 

We are focused on leveraging next-generation technologies including 5G, Blockchain, Cybersecurity, Artificial Intelligence, and more, to enable end-to-end digital transformation for global customers. Tech Mahindra is one of the fastest-growing brands and amongst the top 15 IT service providers globally. 

Tech Mahindra has consistently emerged as a leader in sustainability and is recognized amongst the ‘2021 Global 100 Most sustainable corporations in the World’ by Corporate Knights. With the NXT.NOW™ framework, Tech Mahindra aims to enhance ‘Human Centric Experience’ for our ecosystem and drive collaborative disruption with synergies arising from a robust portfolio of companies. 

Tech Mahindra aims at delivering tomorrow’s experiences today and believes that the ‘Future is Now.

We are part of the Mahindra Group, founded in 1945, one of the largest and most admired multinational federations of companies with 260,000 employees in over 100 countries. It enjoys a leadership position in farm equipment, utility vehicles, information technology, and financial services in India and is the world’s largest tractor company by volume. It has a strong presence in renewable energy, agriculture, logistics, hospitality, and real estate. 

The Mahindra Group has a clear focus on leading ESG globally, enabling rural prosperity and enhancing urban living, with a goal to drive positive change in the lives of communities and stakeholders to enable them to rise."
159,Genpact,4.0,(20k Reviews),Public,"New York,New York + 68 more",25 years old,50k-1 Lakh Employees (India),"Change is constant. At Genpact, we’re the ones driving it. We think with design, dream in digital, and solve problems with data and analytics. We obsess over operations and focus on the details – all 78,000+ of us. And you could be one of us!
We are a global professional services firm that makes business transformation real. We drive digital-led innovation and digitally-enabled intelligent operations for our clients, guided by our experience running thousands of processes for hundreds of Global Fortune 500 companies.
From New York to New Delhi and more than 20 countries in between, Genpact has the end-to-end expertise to connect every dot, reimagine every process, and reinvent companies’ ways of working. And it offers you an unparalleled opportunity to grow and transform your career."
160,HCLTech,3.8,(19k Reviews),Public,Noida + 143 more,31 years old,1 Lakh+ Employees (India),"HCLTech is a global technology company, home to 219,000+ people across 54 countries, delivering industry-leading capabilities centered around digital, engineering and cloud powered by a broad portfolio of technology services and products. We work with clients across all major verticals, providing industry solutions for Financial Services, Manufacturing, Life Sciences and Healthcare, Technology and Services, Telecom and Media, Retail and CPG, and Public Services.

Our purpose is to bring together the best of technology and our people to supercharge progress. We’re supercharging progress for everyone, everywhere – our clients, partners and their stakeholders, our people, communities, and the planet.

Part of the HCL group, HCLTech was listed on the stock exchanges in India at the turn of the millennium in December, 1999. Since our inception, we pioneered several industry mainstays and established leadership position in all our chosen segments.

As a company we are deeply focused on accelerating our ESG agenda. We are also creating technology-enabled sustainable solutions with and for our clients and partners. We embed ESG imperatives into every aspect of our business and ensure that the progress we supercharge is responsible, inclusive and beneficial to all our stakeholders in the long-term. We have committed to achieving net-zero by 2040.

We recognize the impact that a business like ours can deliver in elevating communities globally, and we continue to improve our efforts and take decisive actions that benefit communities in which we work and live. Through the HCL Foundation, the CSR arm of HCLTech, we have invested more than $130 million in social development efforts serving communities throughout India across education, health, water, sanitation and hygiene, skill development and livelihoods, environment, and disaster risk reduction, response and management.

We’re powered by our people – a global, diverse, multi-generational talent - representing 167 nationalities whose unique spark, perspective and boundless passion drive our culture of proactive value creation and problem-solving. 
 
Consolidated revenues as of 12 months ending September 30, 2022 totaled $12.1 billion. To learn how we can supercharge progress for you, visit hcltech.com."
161,Amazon,4.3,(18.9k Reviews),Public,"Seattle,Washington + 394 more",28 years old,1 Lakh+ Employees (India),"Amazon is guided by four principles: customer obsession rather than competitor focus, passion for invention, commitment to operational excellence, and long-term thinking. 

We are driven by the excitement of building technologies, inventing products, and providing services that change lives. We embrace new ways of doing things, make decisions quickly, and are not afraid to fail. We have the scope and capabilities of a large company and the spirit and heart of a small one. 

Together, Amazonians research and develop new technologies from Amazon Web Services to Alexa on behalf of our customers: shoppers, sellers, content creators, and developers around the world. 

Our mission is to be Earth's most customer-centric company. Our actions, goals, projects, programs, and inventions begin and end with the customer's top of mind. 

You'll also hear us say that at Amazon, it's always ""Day 1.""​ What do we mean? That our approach remains the same as it was on Amazon's very first day - to make smart, fast decisions, stay nimble, invent, and focus on delighting our customers."
